number,value,datetime_start,datetime_complete,duration,params_max_exposure_pct,params_min_adr,params_min_rvol,params_risk_dollars,params_rvol_danger_size,params_signal_type,params_tp1_r,params_tp2_r,state
447,0.27341448547569913,2026-01-10 01:15:09.207487,2026-01-10 01:15:09.983638,0 days 00:00:00.776151,0.3,1.0,1.5,250,0.4,breakout,1.5,3.5,COMPLETE
448,0.2729204195107488,2026-01-10 01:15:09.985650,2026-01-10 01:15:10.766179,0 days 00:00:00.780529,0.25,1.0,1.5,200,0.4,breakout,2.0,3.5,COMPLETE
449,0.20605149121597036,2026-01-10 01:15:10.768285,2026-01-10 01:15:11.559885,0 days 00:00:00.791600,0.3,1.0,1.0,250,0.4,breakout,2.0,3.5,COMPLETE
